{
  "$schema": "https://sethmay.github.io/open-scout-api/schema/v1/merit-badge.schema.json",
  "id": "historic-pathfinding",
  "kind": "merit-badge",
  "versions": [
    {
      "valid_from": "2010",
      "valid_to": "2010",
      "name": "Historic Pathfinding",
      "bsa_number": 140,
      "eagle_required": null,
      "tags": [],
      "description": null,
      "url": null,
      "provenance": {
        "sources": [
          {
            "url": "http://usscouts.org/mb/history.asp",
            "accessed": "2026-07-27"
          }
        ],
        "method": "scraped",
        "verified_at": "2026-07-27",
        "confidence": 0.8,
        "notes": "Discontinued badge recovered from the USSSP merit badge history table, which marks retired badges in its own markup. eagle_required is null because it cannot be sourced for badges retired before the modern published Eagle list."
      }
    }
  ],
  "notes": "Historic Program for 2010 only"
}
