{
  "$schema": "https://sethmay.github.io/open-scout-api/schema/v1/merit-badge.schema.json",
  "id": "snow-sports",
  "kind": "merit-badge",
  "versions": [
    {
      "valid_from": null,
      "valid_to": null,
      "name": "Snow Sports",
      "eagle_required": false,
      "tags": [
        "sports",
        "outdoor"
      ],
      "description": "Ski, snowboard or snowshoe under control on real terrain, wax and tune your own gear, read trail markings and avalanche warnings, and treat the frostbite, hypothermia and falls that come with cold-weather sport.",
      "url": "https://www.scouting.org/merit-badges/snow-sports/",
      "provenance": {
        "sources": [
          {
            "citation": "OpenScouting/workbooks badges/MANIFEST.md (catalogue facts)"
          },
          {
            "url": "https://www.scouting.org/merit-badges/snow-sports/"
          }
        ],
        "method": "curated",
        "verified_at": "2026-07-21",
        "confidence": 0.9
      }
    }
  ],
  "notes": null
}
