{
  "$schema": "https://sethmay.github.io/open-scout-api/schema/v1/merit-badge.schema.json",
  "id": "photography",
  "kind": "merit-badge",
  "versions": [
    {
      "valid_from": null,
      "valid_to": null,
      "name": "Photography",
      "eagle_required": false,
      "tags": [
        "arts"
      ],
      "description": "Control light, aperture, shutter speed, and depth of field, frame with the rule of thirds and leading lines, edit what you shoot, and assemble a dozen images into a photo story that holds together.",
      "url": "https://www.scouting.org/merit-badges/photography/",
      "provenance": {
        "sources": [
          {
            "citation": "OpenScouting/workbooks badges/MANIFEST.md (catalogue facts)"
          },
          {
            "url": "https://www.scouting.org/merit-badges/photography/"
          }
        ],
        "method": "curated",
        "verified_at": "2026-07-21",
        "confidence": 0.9
      }
    }
  ],
  "notes": null
}
