{
  "$schema": "https://sethmay.github.io/open-scout-api/schema/v1/merit-badge.schema.json",
  "id": "electricity",
  "kind": "merit-badge",
  "versions": [
    {
      "valid_from": "1911",
      "valid_to": null,
      "name": "Electricity",
      "eagle_required": false,
      "tags": [
        "stem",
        "trades"
      ],
      "description": "Wire simple circuits, build an electromagnet and a rheostat, read a household meter, find an overloaded branch circuit, and rescue and treat someone who has taken a shock.",
      "url": "https://www.scouting.org/merit-badges/electricity/",
      "provenance": {
        "sources": [
          {
            "citation": "OpenScouting/workbooks badges/MANIFEST.md (catalogue facts)"
          },
          {
            "url": "https://www.scouting.org/merit-badges/electricity/"
          },
          {
            "url": "http://usscouts.org/mb/history.asp",
            "accessed": "2026-07-27"
          }
        ],
        "method": "curated",
        "verified_at": "2026-07-21",
        "confidence": 0.9,
        "notes": "Introduction year (and BSA number where absent) backfilled from the USSSP merit badge history table; for a renamed badge this is when THIS name took effect, not when the lineage began."
      },
      "bsa_number": 43
    }
  ],
  "notes": null
}
