{
  "$schema": "https://sethmay.github.io/open-scout-api/schema/v1/merit-badge.schema.json",
  "id": "small-boat-sailing",
  "kind": "merit-badge",
  "versions": [
    {
      "valid_from": null,
      "valid_to": null,
      "name": "Small-Boat Sailing",
      "eagle_required": false,
      "tags": [
        "aquatics"
      ],
      "description": "Rig a small sailboat and take it through the basic points of sail, tack and jibe around a course, get out of irons, recover from a capsize, and tie the knots that hold everything fast.",
      "url": "https://www.scouting.org/merit-badges/small-boat-sailing/",
      "provenance": {
        "sources": [
          {
            "citation": "OpenScouting/workbooks badges/MANIFEST.md (catalogue facts)"
          },
          {
            "url": "https://www.scouting.org/merit-badges/small-boat-sailing/"
          }
        ],
        "method": "curated",
        "verified_at": "2026-07-21",
        "confidence": 0.9
      }
    }
  ],
  "notes": null
}
