{
  "$schema": "https://sethmay.github.io/open-scout-api/schema/v1/merit-badge.schema.json",
  "id": "family-life",
  "kind": "merit-badge",
  "versions": [
    {
      "valid_from": null,
      "valid_to": null,
      "name": "Family Life",
      "eagle_required": true,
      "tags": [
        "citizenship",
        "health"
      ],
      "description": "Take on regular chores for three months, lead a project the whole family joins, and run family meetings about money, technology, manners, and the pressures facing young people.",
      "url": "https://www.scouting.org/merit-badges/family-life/",
      "provenance": {
        "sources": [
          {
            "citation": "OpenScouting/workbooks badges/MANIFEST.md (catalogue facts)"
          },
          {
            "url": "https://www.scouting.org/merit-badges/family-life/"
          },
          {
            "url": "https://www.scouting.org/skills/merit-badges/eagle-required/"
          }
        ],
        "method": "curated",
        "verified_at": "2026-07-21",
        "confidence": 0.9
      }
    }
  ],
  "notes": null
}
