{
  "$schema": "https://sethmay.github.io/open-scout-api/schema/v1/merit-badge.schema.json",
  "id": "scouting-heritage",
  "kind": "merit-badge",
  "versions": [
    {
      "valid_from": "2010",
      "valid_to": null,
      "name": "Scouting Heritage",
      "eagle_required": false,
      "tags": [
        "heritage",
        "collecting"
      ],
      "description": "Trace Scouting from Baden-Powell and Brownsea Island to the people who grew the movement in this country, gather patches and memorabilia, revive an old-time Scout game, and interview Scouts from earlier generations.",
      "url": "https://www.scouting.org/merit-badges/scouting-heritage/",
      "provenance": {
        "sources": [
          {
            "citation": "OpenScouting/workbooks badges/MANIFEST.md (catalogue facts)"
          },
          {
            "url": "https://www.scouting.org/merit-badges/scouting-heritage/"
          },
          {
            "url": "http://usscouts.org/mb/history.asp",
            "accessed": "2026-07-27"
          }
        ],
        "method": "curated",
        "verified_at": "2026-07-21",
        "confidence": 0.9,
        "notes": "Introduction year (and BSA number where absent) backfilled from the USSSP merit badge history table; for a renamed badge this is when THIS name took effect, not when the lineage began."
      },
      "bsa_number": 143
    }
  ],
  "notes": null
}
