{
  "$schema": "https://sethmay.github.io/open-scout-api/schema/v1/merit-badge.schema.json",
  "id": "theater",
  "kind": "merit-badge",
  "versions": [
    {
      "valid_from": null,
      "valid_to": null,
      "name": "Theater",
      "eagle_required": false,
      "tags": [
        "arts"
      ],
      "description": "Review full-length plays you have seen or read, write a one-act with real conflict and a climax, and take a production role: acting, directing, sets, costumes, lighting, sound or stage managing.",
      "url": "https://www.scouting.org/merit-badges/theater/",
      "provenance": {
        "sources": [
          {
            "citation": "OpenScouting/workbooks badges/MANIFEST.md (catalogue facts)"
          },
          {
            "url": "https://www.scouting.org/merit-badges/theater/"
          }
        ],
        "method": "curated",
        "verified_at": "2026-07-21",
        "confidence": 0.9
      }
    }
  ],
  "notes": null
}
