{
  "$schema": "https://sethmay.github.io/open-scout-api/schema/v1/merit-badge.schema.json",
  "id": "farm-mechanics",
  "kind": "merit-badge",
  "versions": [
    {
      "valid_from": null,
      "valid_to": null,
      "name": "Farm Mechanics",
      "eagle_required": false,
      "tags": [
        "trades"
      ],
      "description": "Set up a safe farm shop, read the warning symbols and safety data sheets on equipment, service an engine-powered machine, dress worn tool heads with a file, and learn what preventive maintenance saves.",
      "url": "https://www.scouting.org/merit-badges/farm-mechanics/",
      "provenance": {
        "sources": [
          {
            "citation": "OpenScouting/workbooks badges/MANIFEST.md (catalogue facts)"
          },
          {
            "url": "https://www.scouting.org/merit-badges/farm-mechanics/"
          }
        ],
        "method": "curated",
        "verified_at": "2026-07-21",
        "confidence": 0.9
      }
    }
  ],
  "notes": null
}
