{
  "$schema": "https://sethmay.github.io/open-scout-api/schema/v1/merit-badge.schema.json",
  "id": "personal-fitness",
  "kind": "merit-badge",
  "versions": [
    {
      "valid_from": "1952",
      "valid_to": null,
      "name": "Personal Fitness",
      "eagle_required": true,
      "tags": [
        "health",
        "sports"
      ],
      "description": "Measure your own aerobic capacity, strength, and flexibility, log what you eat, then follow a twelve-week program of warm-ups, cardio, strength work, and stretching and retest to see what actually improved.",
      "url": "https://www.scouting.org/merit-badges/personal-fitness/",
      "provenance": {
        "sources": [
          {
            "citation": "OpenScouting/workbooks badges/MANIFEST.md (catalogue facts)"
          },
          {
            "url": "https://www.scouting.org/merit-badges/personal-fitness/"
          },
          {
            "url": "https://www.scouting.org/skills/merit-badges/eagle-required/"
          },
          {
            "url": "http://usscouts.org/mb/history.asp",
            "accessed": "2026-07-27"
          }
        ],
        "method": "curated",
        "verified_at": "2026-07-21",
        "confidence": 0.9,
        "notes": "Introduction year (and BSA number where absent) backfilled from the USSSP merit badge history table; for a renamed badge this is when THIS name took effect, not when the lineage began."
      },
      "bsa_number": 10
    }
  ],
  "notes": null
}
