{
  "$schema": "https://sethmay.github.io/open-scout-api/schema/v1/merit-badge.schema.json",
  "id": "emergency-preparedness",
  "kind": "merit-badge",
  "versions": [
    {
      "valid_from": "1972",
      "valid_to": null,
      "name": "Emergency Preparedness",
      "eagle_required": true,
      "tags": [
        "safety",
        "citizenship"
      ],
      "description": "Work out how to prevent, survive, and recover from disasters from kitchen fires to hurricanes, build a family escape plan and a disaster kit, signal rescuers, and mobilize your troop to help.",
      "url": "https://www.scouting.org/merit-badges/emergency-preparedness/",
      "provenance": {
        "sources": [
          {
            "citation": "OpenScouting/workbooks badges/MANIFEST.md (catalogue facts)"
          },
          {
            "url": "https://www.scouting.org/merit-badges/emergency-preparedness/"
          },
          {
            "url": "https://www.scouting.org/skills/merit-badges/eagle-required/"
          },
          {
            "url": "http://usscouts.org/mb/history.asp",
            "accessed": "2026-07-27"
          }
        ],
        "method": "curated",
        "verified_at": "2026-07-21",
        "confidence": 0.9,
        "notes": "Introduction year (and BSA number where absent) backfilled from the USSSP merit badge history table; for a renamed badge this is when THIS name took effect, not when the lineage began."
      },
      "bsa_number": 6
    }
  ],
  "notes": null
}
