{
  "$schema": "https://sethmay.github.io/open-scout-api/schema/v1/merit-badge.schema.json",
  "id": "coin-collecting",
  "kind": "merit-badge",
  "versions": [
    {
      "valid_from": null,
      "valid_to": null,
      "name": "Coin Collecting",
      "eagle_required": false,
      "tags": [
        "collecting"
      ],
      "description": "Learn how coins are struck and what obverse, reverse, reeding, and clad mean, assemble sets of cents, nickels, dimes, quarters, and dollars, and find out who appears on United States paper currency.",
      "url": "https://www.scouting.org/merit-badges/coin-collecting/",
      "provenance": {
        "sources": [
          {
            "citation": "OpenScouting/workbooks badges/MANIFEST.md (catalogue facts)"
          },
          {
            "url": "https://www.scouting.org/merit-badges/coin-collecting/"
          }
        ],
        "method": "curated",
        "verified_at": "2026-07-21",
        "confidence": 0.9
      }
    }
  ],
  "notes": null
}
